subreddit,thread_title,focal_post,submission_text,comment_1,comment_2,coder1,coder2,coder3,training_label,classification
results/Conservative/,53 percent in new poll say they would not support Trump if he is GOP nominee,comment_2,url: [https://thehill.com/homenews/campaign/4154705-53-percent-in-new-poll-say-they-would-not-support-trump-if-nominated/](https://thehill.com/homenews/campaign/4154705-53-percent-in-new-poll-say-they-would-not-support-trump-if-nominated/),cool story hansel,"Trump is the Democrat's best asset to winning. 
 

 There's a massive 35% gap between how GOP primary voters view Trump and how general election voters (who decide the election) view him. 70% of our voters view him favorably but only 35% of general election voters view him favorably.
 

 53% would definitely not vote for Trump and even more (62%) have a unfavorable view of him. The GOP is going to electoral suicide if Trump is nominated.",,,,,Neutral
results/Libertarian/,Thoughts on FHA loans,comment_2,What is libertarians thoughts on FHA loans? what is your thoughts on the current housing market situation. What would libertarians do?,"FHA loans are another ""moral hazard"" situation that politicians just love to establish. 
 

 They drive up the price of housing and destabilize the market so politicians can claim more people are home owners, while at the same time protecting their cronies in the banking industry from risk.","Agreed, but also; you should take every opportunity afforded to you, so if you can take advantage of one, go for it.",,,,,Neutral
results/Liberal/,Defense Secretary Lloyd Austin blasts GOP senator's blockade of military promotions as 'unnecessary' and 'unsafe',comment_1,"It is not safe under any circumstances that one person should, on purpose, have the ability to hault positions from being filled. For the first time in USA history, three out of four top level positions in the DoD are vacant. And? There are other military positions that are left vacant. Shameful.","Prioritizing political ideology over National Defense.
 

 This, to me, is the very definition of ""NOT serving your Country"".
 

 The sonofabitch needs to be forced to *resign*.","Tubberman's holding the positions for trump to fill with loyalists...
 

 Then the coup will be complete.",,,,,Neutral
results/Liberal/,"Hello, first time poster.",comment_2,How do people still support Trump? The man literally told people to raid the capital building and incentivised it. He's literally such a psycho and people still worship him as if he's the lord and savior.,"They like the hate he amplified. He singled in on a group of old white people who were already afraid their world was being taken from them by poc and immigrants etc. Trump gave them all permission to hate and be angry and afraid. In 2010 he was talking about he was pro choice now all of a sudden bc his base is a bunch of white ""christians"" he is pro life. He is literally just feeding a bunch of angry scared grown what they want to hear so they can go on Facebook and show off to their buddies how they owning the libs. It's sickening that anyone would support him in any way after all he has done to this country. Who knows who he sold those documents to. We should all be worried and pissed off about how he put us all in danger. He divided us at a time we needed to come together more than ever. He turned a deadly pandemic into a conspiracy. He is a joke and anyone who supports him just wants their ticket to hate then go to church on Sunday and pretend they are so holy and good.","The shortest answer I can offer is this: They don't see the same facts, opinions, or commentary that the rest of us do, instead they're flooded with propaganda peddling victimization and resentment.  
  
 There are millions of people who still support Trump, and I can't speak for all of them, some of them might genuinely appreciate what he did as President, others might not know the *bad* things he did as President, but one commonality I feel confident proposing is that most of them don't see the world the same way you and I do.  
  
 Back in 2016 we'd gotten our country down to a 4.5% unemployment rate after years of struggling to recover from the great recession, but the people who were voting for Donald Trump thought the unemployment rate was closer to **15%.** The facts of the world don't matter if people don't know about them.  
  
 This is shameful of me to say, but if I **believed** the same thing about immigrants that Trump's supporters **believe** about immigrants, I'd probably want a border wall, too.  
  
 By and large we don't believe the same things about the world that Trump's voters believe about the world, and so when we try to understand their behavior we come to a dead end. If you want to understand why people do the things they do in the world, it helps to know how they perceive that world.","Condescending Attitude, Polarizing or Tribalistic Language","Polarizing or Tribalistic Language,Condescending Attitude",,"Polarizing or Tribalistic Language,Condescending Attitude",IA
results/Libertarian/,"Maybe ""accountants"" shouldn't be armed?",comment_1,This wouldn't happen at a calculator range.,I love happy endings,"I could watch irs agents shoot eachother all day, I dont give a shit about your irs agents",,,,,Neutral
results/conservatives/,Eric Adams Calls Texas To Ask If They Have Any More Of Those Cowboy Guys With The Whips,comment_1,https://babylonbee.com/news/eric-adams-calls-texas-to-ask-if-they-have-any-more-of-those-cowboys-with-the-whips/,Texas put him on Hold. 🤗,Wild that NYC elected a literal Nazi to be their mayor.,,,,,Neutral
results/Libertarian/,Sick of these “Nazis were Socialist” posts. Let’s argue about the US Senate. Why should RI or MT have the same number of senators as CA or TX?,comment_1,"IMO everyone’s vote should be valued equally, regardless of zip code. That’s not the case with the senate.","The senate represents the state not the people, originally many state legislatures appointed the senators.  
 

 The goal of the system is we are a coalition of independent states, and a majority of states and citizens (house of representatives) in general must support changes.  
 

 The big problem came when during crisis the federal government grew drastically in scope and replaced the states authority, ab use of the commerce clause has been a big part of that.",">IMO everyone’s vote should be valued equally, regardless of zip code. 
 

 Should the big cities really have control over the less-densely populated farm lands? 
 How would that feel for the farmer trying to live a life away from the madness of the city.
 

 How about all those city people vote on local laws if they deem it necessary?",,,,,Neutral
results/Libertarian/,What do you think about the government putting extra taxes on foreign imports to deliberately and artificially favor locally made alternatives?,comment_2,"I was talking with a leftist and this topic came up. In my country, some time ago a leftist government started this kind of policy campaign where various imported goods suddenly had a new stupid extra tax because the local alternatives ""couldn't compete"" with the prices. From the get go, of course it's shit just read this title the immediate reaction is ""fuck no that is bad"". I remember I hated it because things like musical instruments that I was very into at a time were expensive as hell and the locally made ones were shit quality. 
 

 Now comes the thing, talking to this leftist I was like yes that was a bad policy, she said well then what do you suggest they do when they can't compete and have to go bankrupt. So I'm like well that's sad it happens they're going to have to go extinct like every company who can't compete they're going to have to work at something else. Then she brought up that well, most people who benefitted from the policy are artisans who work in the countryside they for the most part don't have an education some don't even know how to read or write it's all generational knowledge that comes from a long ""family business"" line or a guild of some sorts blah blah blah the idea is that they're not really competitive in the normal job market and will probably be in big trouble. So at this point, I didn't know what to tell the leftist and that's why I'd like you guys to give me an answer.
 

 Is a policy like this ever acceptable? I don't think so. Is the problem deeper as in why the hell are people still living like that in the first place? What can they do, or what can someone else do to fix the problem?","**New to libertarianism or have questions and want to learn more?** Be sure to check out [the sub Frequently Asked Questions](/r/Libertarian/wiki/faq) and [the massive /r/libertarian information WIKI] (/r/Libertarian/wiki/index) from the sidebar, for lots of info and free resources, links, books, videos, and answers to common questions and topics. Want to know if you are a Libertarian? [Take the worlds shortest political quiz and find out!](http://www.theadvocates.org/)
 

 *I am a bot, and this action was performed automatically. Please [contact the moderators of this subreddit](/message/compose/?to=/r/Libertarian) if you have any questions or concerns.*","I'm against it, but as a negotiating tactic to get the other government to reduce their own tariffs and subsidies it can be effective.",Engages Respectfully with Diverse Perspectives,,"Engages Respectfully with Diverse Perspectives,Acknowledges Personal Beliefs","Engages Respectfully with Diverse Perspectives,Acknowledges Personal Beliefs",IH
results/Libertarian/,When someone says “I’m an Independent.” Do you feel as if it’s the same as Libertarian?,comment_2,Or is it someone who just dosn’t want to be accountable for one of the two major parties they may have voted for?,"People who say ""I'm an independent"" are usually one of two things:
 

 1. Swing voters who actually make a decision based on the candidate
 2. People embarrassed to just say they're an R/D
 

 If 90% of the time you're for the same party, you're not an independent.",Now what if that 90% of the time you allow a coin flip to decide? That's truly independent.,,,,,Neutral
results/Conservative/,Warning To Californians: 'Shocking New Income Redistribution Scheme' Coming Ripped By Steve Forbes,comment_1,"[https://youtu.be/PGGgfVJXMoo](https://youtu.be/PGGgfVJXMoo)
 

 Is this true?? and if not, how likely is it that this is actually going to pass... This is insane",The state law has passed: https://www.cnet.com/home/energy-and-utilities/electricity-bills-in-california-will-soon-be-based-on-income-heres-how-it-could-work/,"Jesus, next thing you know, groceries will be sold by income.",,,,,Neutral
results/Conservative/,"Has Conservative thought shifted over the last decade, and if so, what caused this and how has it changed?",comment_2,"I am often considered Conservative by friends to the Left. I tend to use the political compass as a reference as it is widely understood and easy to use. Right now I feel fairly politically homeless in todays climate as I don’t feel either major party represents my views. I’ve seen the Left shift pretty drastically from 10 to 15 years ago, though they claim the Right has actually moved further Right rather than them moving further Left. Has Conservative thought shifted as much as they say, and if so, what do you think caused it and how has it changed?",The Republican party embraced Trumps protectionism and seems to have thrown their once beloved Milton Friedman out the window. What’s particularly weird is that a lot of free trade arguments mirror free market arguments but the party kept one and discarded the other.,"Conservatives are less conservative than 10-15 years ago. What’s changed imo is how conservatives are forced to get things done now. We have to pass laws and ban things instead of just abstaining. Used to be we just didn’t support things and they didn’t happen, now if we don’t actively legislate on things, they get worse. That’s why you’re seeing all the backlash against Desantis by the left. He’s using the same tactics the left has used for decades and they hate it. 
 

 In short, conservatives have to use progressive tactics to prevent progressive legislation. This is the new “conservative” evolution and I don’t think conservatives like it either but it’s almost a necessary evil to go to bat against the democrat agenda.",Polarizing or Tribalistic Language,,Polarizing or Tribalistic Language,Polarizing or Tribalistic Language,IA
results/Libertarian/,85 countries still practice slavery,comment_1,"This includes . . .  
 Israel 
 Brazil  
 Iran  
 South Korea  
 Singapore  
 Switzerland  
 Russia  
 Ukraine  
 North Korea  
 South Korea  
 Sweden  
 Vietnam  
 Turkey  
 Syria  
 No free country forces their people to sell their life for the government","You're talking about compulsory military service, took me a moment to figure it out. Yes I'm against that.","Do you feel the same about compulsory peacetime military service? For example, a 1 year term that’s more aimed towards basic training? 
 

 I am against conscription, however if my country were to be invaded, you would want a military capable of defending itself. 
 

 Maybe instead of a massive standing army ($$$) you could have capable people reasonably ready. 
 

 I know lots of you will disagree, but I think it’s a reasonable discussion.",,,,Acknowledges Personal Beliefs,IH
results/PoliticalDiscussion/,Is anyone still on the fence about trump?,comment_2,I have heard a lot of people talk about the people who are still on the fence and how they will react to trumps actions but this far in to his political carrier are there really still people who are set in their opinions? ( both positive or negative opinions ),"[A reminder for everyone](https://www.reddit.com/r/PoliticalDiscussion/comments/4479er/rules_explanations_and_reminders/). This is a subreddit for genuine discussion:
 

 * Please keep it civil. Report rulebreaking comments for moderator review.
 * Don't post low effort comments like joke threads, memes, slogans, or links without context.
 * Help prevent this subreddit from becoming an echo chamber. Please don't downvote comments with which you disagree.
 

 Violators will be fed to the bear.
 

 ---
 

 *I am a bot, and this action was performed automatically. Please [contact the moderators of this subreddit](/message/compose/?to=/r/PoliticalDiscussion) if you have any questions or concerns.*",The only people who are on the fence about Trump are those waking up from a 10 year coma. Everyone else is lying.,,Condescending Attitude,Condescending Attitude,Condescending Attitude,IA
results/Conservative/,Hope everyone has a nice 4th!,comment_2,Here's how my wife celebrates,Why…,"Tired of reporting this thread? [Debate us on discord instead.](https://discord.com/invite/conservative)
 

 *I am a bot, and this action was performed automatically. Please [contact the moderators of this subreddit](/message/compose/?to=/r/Conservative) if you have any questions or concerns.*",,,,,Neutral
results/Conservative/,"Bat-wielding kids attack San Francisco moms, nannies outside school in wealthy neighborhood | Fox News",comment_1,"Rafael Mandelman is blaming the pandemic, that is precious.",Must be Wednesday.,It's a shame that laws prevent people from being able to protect themselves from the weak minded.,,,,,Neutral
results/Liberal/,Man walking dog sees bags = VOTER FRAUD!!,comment_1,"Hey Reddit, I need some help locating an article/court ruling that I swear I saw about a year ago and thought would be easy to re-find, but I guess not.
  
 

  
 The article was reporting on a Judge's opinion written about one of the pro-trump court cases filed after the 2020 election. I think it was a censure of the lawyers who submitted the case because it was so far off from a legitimate legal challenge that it should never have come close to a courtroom, but I don't recall the details. 
  
 

  
 The thing that stood out was that the judge described some of the ""evidence"" used in the filing. One example was roughly that a guy was walking his dog down the street and saw postal workers loading black bags into a postal van. The guy thought the bags might have been fraudulent ballots headed to the counting center nearby.
  
 

  
 That was it. Just a guy walking his dog thought some black bags might be ballots. That was their ""evidence"" of fraud.
  
 

  
 I kind of couldn't believe it so at the time I was able to find the original court filing and sure enough, they really had ""testimony"" from a guy who was walking his dog and saw postal workers loading bags into a van. As far as we know, they could have been early christmas cards, but these lawyers really thought that was sufficient evidence to include in a real lawsuit alleging voter fraud. 
  
 

  
 BUT... after all that fun, I can't find the article or ruling anywhere.
  
 

  
 Anyone else recall this article and/or able to locate the ruling?",There was one incident in Harris County that went unreported that involved election workers picking up ballots while leaving previously collected ballots unsupervised in the parking lot.,"It isn't the one you refer to but was amusing
 

 [https://www.cbsnews.com/sanfrancisco/news/dog-vote-santa-cruz-county-voter-fraud/](https://www.cbsnews.com/sanfrancisco/news/dog-vote-santa-cruz-county-voter-fraud/)
 

 There were more than 60 such things. Somewhere there should be a case by case tally but I have not found it yet.",,,,,Neutral
results/Conservative/,The price of a vote in times of inflation,comment_2,"In previous elections a cheap cell phone could buy a vote.  Now the price is an efficient air conditioner.
 

 https://www.foxnews.com/politics/biden-administration-buy-air-conditioning-units-environmental-justice",Obamaphones are no match for Biden AC's.,They don't know what fans are?,,,,,Neutral
results/Conservative/,Trudeau is getting a divorce,comment_2,https://www.theglobeandmail.com/politics/article-justin-trudeau-and-sophie-gregoire-trudeau-announce-separation/,Soyboy ain’t getting it done huh?,Must have been caught in bed with the Liberals,,,,,Neutral
results/Conservative/,This book claims mainstream media has a conservative bias,comment_2,"This book claims Tupac was a ""leftist"" and that all the mainstream media has a ""conservative bias"". The author is a White leftist. These are both absurd claims. Tupac became a multi millionaire success because of capitalism. This author seems to be claiming this in hopes that a young person with no knowledge of what a leftist is, would assume it must be cool if Tupac was a leftist. I don't know why he would say the mainstream media has a conservative bias. It's been a liberal bias for my whole life","When your such a lefty even Karl Marx would go ""Whoa there bucko"" then even MSNBC seems conservative.",It used to,,,,,Neutral
results/politics/,Saturday Morning Political Cartoon Thread,comment_1,"It's Saturday, folks. Let's all kick back with a cup of coffee and share some cartoons!
 

 Feel free to share political cartoons in this thread. Besides our usual civility policy, there are three rules to follow:
 

 1. Every top-level comment must contain a political cartoon. This means no text-only top-level comments.
 

 

 2. It must be an original cartoon. This means no photographs, no edited cartoons, no AI generated images, no templates, no memes and no image macros. OC is allowed, as is animation.
 

 

 3. Each top-level comment should only have a maximum of 3 cartoons. 
 

 

 That's all. Enjoy your weekend!","Ruben Bolling:
 

 [American history, Florida edition](https://www.dailykos.com/blog/RubenBolling)","Jen Sorensen:
  
 [Master plans](https://thenib.com/thinking-big/)",,,,,Neutral
results/Liberal/,Sound of Freedom,comment_1,"WhIt's fine in the sense of movie. All movies contain certain truths, but it is abused by certain questionable groups. As it is a movie, it contains fictional details & exaggerations to push it's message. It simplifies the reality, as if it's easy to just go in and rescue someone, so why isn't the police in these countries doing it? \[Because it's not so simple\]
 

 The actual organization used to have a question mark rating, but I guess someone asked them to change it. [https://www.charitywatch.org/charities/operation-underground-railroad](https://www.charitywatch.org/charities/operation-underground-railroad)
 

 This movie is a bit ""Do you Hear the People Sing"" in Les Miserables being used as for January 6 riot, ""misuse"", with the addition that the actor openly embraces QAnon, complicating the situation.",Is movie good?,Did those motherfuckers really taint Les Mis like that?,,,,,Neutral
results/Conservative/,WATCH: Poilievre says Trudeau does not believe in liberalism,comment_2,Poilievre is the new leader of Canada's Conservative Party,"I believe most leaders don't believe what they say, the right or left. They just say what people want to hear for power.",True of every party. They say one thing on the campaign trail but do another thing in power. All you can do is vote for whom you dislike the most.,,,,,Neutral
results/conservatives/,"In major shift, RFK Jr. calls for corruption investigation of Joe Biden",comment_2,https://justthenews.com/accountability/political-ethics/major-shift-rfk-jr-calls-corruption-investigation-biden,All parties should welcome and demand an investigation into these issues. They should be put to rest for the sake of our republic.,"While Democrats are ruthless in prosecuting and indicting Trump and Republican voters, there's little to no parties that are barely doing anything to pressure action against Biden corruption despite so much evidence coming out.",,,,,Neutral
results/Liberal/,Here we go! Republicans trying to scrub eligible voters off the voter registration system. AGAIN,comment_1,"https://apnews.com/article/lawsuit-wisconsin-voter-registration-forms-ruling-judge-4d424018f362a7e0723d2517501b35e8
 

 Are we fed up with these liars and criminals yet?",So sick of it!,"Yes, but the people who vote for them love every minute of this. All that right wing media and socila media has them convinced that Dems. are the downfall of America, and preventing that is a lot more important than allowing every eligible Democrat to vote.",,,,,Neutral
results/conservatives/,"Disabled vet dead after FBI swats Tennessee home, family seeks answers ""It was a senseless act. You know Teddy was a 100 percent disabled veteran.""",comment_2,https://thepostmillennial.com/disabled-vet-dead-after-fbi-swats-tennessee-home-family-seeks-answers,"There is no legitimate reason for FBI agents to be armed on duty, and there is REALLY no legitimate reason to trust them to ""investigate"" themselves.","This shiat is getting out of control. I’ll wait for more facts, but the shooting in Utah sure seemed like it was extremely excessive…",Recognizes limitations in ones own knowledge or beliefs,Recognizes limitations in ones own knowledge or beliefs,,Recognizes limitations in ones own knowledge or beliefs,IH
results/Libertarian/,Am I a Libertarian?,comment_2,"I am unsure if I'm a conservative or libertarian here are my positions:
 

 * Doctors and pilots should get government approved licenses.
 * Roads by and large should be mostly funded by the government.
 * All drugs aside from date rape drugs should be legal.
 * Low taxation, low government spending, fewer regulations.
 * Some regulations with concerns to safety should be required.
 * Healthcare should be private and allow companies to compete across state lines to lower costs, and allow importing drugs from Canada, and government can negotiate drug costs without forceful price controls. 
 * Pro life (except for life of mother being in danger).
 * Tariff foreign imports if the company is receiving subsidies from their home country.  
 * End all corporate subsidies.
 * Allow gay marriage, but don't force religious people to make cake or wed gay couples.
 * Large military budget.
 * No open borders. 
 * FDA FAA and other government regulators should be kept. 
 * In favor of private unions.
 * No more oil from middle east, russia, or any other authoritarian countries, get all the oil from US and be the largest exporter. 
 * Abolish minimum wage and rent control, and similar price controls.
 * In favor of giving Ukraine weapons.
 * In favor of oil being a transitionary fuel, that should be replaced by nuclear, and wind in the future when infrastructure is updated for those fuels. 
 * Pro 2nd Amendment (no explosives).","**New to libertarianism or have questions and want to learn more?** Be sure to check out [the sub Frequently Asked Questions](/r/Libertarian/wiki/faq) and [the massive /r/libertarian information WIKI] (/r/Libertarian/wiki/index) from the sidebar, for lots of info and free resources, links, books, videos, and answers to common questions and topics. Want to know if you are a Libertarian? [Take the worlds shortest political quiz and find out!](http://www.theadvocates.org/)
 

 *I am a bot, and this action was performed automatically. Please [contact the moderators of this subreddit](/message/compose/?to=/r/Libertarian) if you have any questions or concerns.*",I´d say you are center-right with a sprinkle of classic liberalism. I don't think I'd label you as a full-on libertarian but you are still invited to the yearly barbecue.,,Engages Respectfully with Diverse Perspectives,Engages Respectfully with Diverse Perspectives,Engages Respectfully with Diverse Perspectives,IH
