subreddit,thread_title,focal_post,submission_text,comment_1,comment_2,coder1,coder2,coder3,training_label,classification
results/Libertarian/,Do disasters like the floods in Libya make you question your libertarian beliefs?,comment_2,"Death tolls rising over 20,000 from the flooding. Or look at the earthquake in Turkey which iirc had over 100,000 dead.  While over regulation tends to kill innovation, it does also make it so in America our huge natural disasters are much less deadly than in a lot of these foreign countries where they clearly don’t have the same level of building codes/inspections.
 

 Obviously our system isn’t great either, we had apartments collapse, and a pretty big mismanaged disaster in Hawaii, but still significantly less disastrous than in countries with no regulation.
 

 In a libertarian country do you really think that giant apartment landlords would keep their buildings up to spec for these 1/1000 types of disasters? Would utility companies sacrifice profit to make sure their dams spend all the extra money repairing a structure that could be destroyed with a catastrophic rainfall or earthquake?
 

 I’m not advocating for more regulation or control. But I’m drawing a blank here on how you can deny that some element of required inspections and building codes is good for a society.","**New to libertarianism or have questions and want to learn more?** Be sure to check out [the sub Frequently Asked Questions](/r/Libertarian/wiki/faq) and [the massive /r/libertarian information WIKI] (/r/Libertarian/wiki/index) from the sidebar, for lots of info and free resources, links, books, videos, and answers to common questions and topics. Want to know if you are a Libertarian? [Take the worlds shortest political quiz and find out!](http://www.theadvocates.org/)
 

 *I am a bot, and this action was performed automatically. Please [contact the moderators of this subreddit](/message/compose/?to=/r/Libertarian) if you have any questions or concerns.*","Turkey and Libya are not libertarian nations with no regulations .. they are examples of why government should not be managing disasters 
 

 And your appeal to emotion about disasters does not invalidate the theft incurred by government on those not impacted by the disaster to fund relief nor the violations of human rights incurred when government manages a disaster [ Katrina being a great example ] or actively funding policies that magnify the scope of a disaster [ like the policies of the NFIP as a great example ] 
 

 Disasters happen and its up to the folks impacted by it to deal with it [ individually or collectively ] ... its not the purview of government to hurth those not impacted by it as a means to help others",Engages Respectfully with Diverse Perspectives,,Engages Respectfully with Diverse Perspectives,,Neutral
results/Republican/,"Vance, Brown call for action against China over fentanyl crisis",comment_1,Vance also called for stronger military action from the White House in going after drug cartels.,"/r/Republican is a partisan subreddit. This is a place for Republicans to discuss issues with other Republicans.
 To those visiting this thread, we ask that unless you identify as Republican that you refrain from commenting and [leave the vote button alone](https://www.reddit.com/r/MetaRepublican/comments/5t017a/this_sub_is_for_republicans_if_you_do_not/). Non republicans who come to our sub looking for a 'different perspective' [subvert that very perspective with their own views when they vote or comment.](http://i.imgur.com/XqL0wfR.jpg)
 

 *I am a bot, and this action was performed automatically. Please [contact the moderators of this subreddit](/message/compose/?to=/r/Republican) if you have any questions or concerns.*","As the fentanyl crisis continues to claim thousands of lives across the country, senators are calling for more forceful efforts to slow China’s role in producing the deadly synthetic version of the drug.
 

 

 “We should be willing to say [to China], ‘If you don’t stop sending fentanyl precursors to Mexico and to our own ports of entry, we’re going to really penalize you guys economically.’ That is the real tool,” Sen. J.D. Vance (R-Ohio) said during an interview on NBC’s “Meet the Press” that aired Sunday.",,,,,Neutral
results/Libertarian/,Dilemma of Material Consequences vs. Libertarian Principles,comment_2,"Hi Libertarians. I have a question:
 

 How do you account for situations when abiding by Libertarian principles results in consequences that seem against common-sense morality? 
 

 For example, if you think the government shouldn't control the healthcare industry to provide healthcare or at least regulate pricing, that will have serious consequences, no matter how noble the principle behind it sounds.
 

 I can't see why, in a free market economy, a company would be willing to insure a sick person, especially anyone born sick. I can't see why a company wouldn't let you become homeless or thousands of pounds in debt to pay for your surgery. Competition might be helpful, but it seems outweighted by the nature of healthcare as a necessity, meaning it's more profitable to price gouge than compete. The companies would realise that if they don't compete with each other they can charge as much as they like. Competition is at it's best with luxury items and items where one can be swapped with another (e.g. 'the bread's expensive nowadays, I'll buy more rice'). Of course, competing is also very inefficient compared to collaborating, but that's another matter. 
 

 Anyway, if you agree with these being the consequences then that'd leave you with two options:
 1- Accept that the abstract principle is more important than the human consequences 
 2-Be against free market healthcare (in which you probably have to give up being a Libertarian)
 

 If you still agree with 1, then I would argue that even if you reject utilitarianism then the principle of the free market alone isn't healthy. Freedom needs to be balanced against responsibility, and other things like kindness and empathy for the disadvantaged. 
 

 Even on pure freedom grounds, does Libertarianism account for the impact of property imbalances on one's freedom? Or the protection of one's labour as a commodity, and the ways in which private property is used to force people to give in to the property owner or else be forced onto the streets? It doesn't seem like free association to me. As a consumer there isn't any freedom in choosing between payment and death in the case of healthcare, or when products provided have the same issues (e.g. what if planned obsolescense is more profitable than competing away from it?). It seems to me that the freedom principle accounts for companies, but not workers or consumers.
 

 Anyway, thanks for reading and I hope this has provided something interesting to think about.","Ok, it's really simple and really complicated at the same time.
 

 Every position that anyone takes is informed by two things, principle and context. Almost no one behaves 100% in accordance with the most extreme version of their principles at all times. So I would say that even if your position in healthcare or homelessness wasn't 100% in line with libertarian principles, that's a really poor reason to jettison libertarianism or say that you aren't a libertarian.
 

 But let's look at healthcare and homelessness.
 

 Why is housing unaffordable? Why is healthcare unaffordable? Most libertarians would say that state regulations on these markets are the reason they are unaffordable in the first place.
 

 Right now, there are AI models that do a better job of diagnosing some illnesses than human doctors can, and that technology is advancing rapidly. Meanwhile, it will still take 12 years post high school and hundreds of thousands of dollars to get an MD, which artificially constrains the supply of medical professionals in the US. Then add to that insane US health insurance industry, and it's no wonder Americans enjoy the least cost-efficient health industry in the world. We have the most overregulated, encumbered environment in the world. I personally believe that we can re-design our system from the ground up with much more libertarian principles and we would have much broader access to health care. Now, did I address your point? Not exactly, since I think in that scenario there would be some people who would slip through the cracks. But the number of people who would need healthcare and not be able to afford it would be so much lower than it is now that I don't lose any sleep over advocating for that change. Put another way, we could deregulate, and then still have a much smaller state sponsored program for the people who slipped through the cracks, and that would still be a much more libertarian solution than our current set up. You get the idea.","Yeah, I definitely understand what you're getting at. I think one issue is that even if we ignore the many people who get ill before getting insurance, I don't see what would stop companies from predatory insurance premium-raising, or wearing away what's included under the insurance. I feel like the resulting state-sponsored program would end up being as large as the NHS in order to actually cover things, but I appreciate you being open to at least some government intervention. Still, like I said, I don't personally think the ensuing competition will be enough to make the prices reasonable, especially considering people who live paycheque-to-paycheque, and if my policy didn't account for people born ill I'd still lose sleep.",Acknowledges Personal Beliefs,,"Engages Respectfully with Diverse Perspectives,Acknowledges Personal Beliefs,Displays Empathy","Engages Respectfully with Diverse Perspectives,Acknowledges Personal Beliefs",IH
results/PoliticalDiscussion/,"Netanyahu and his party on one side and Supreme court on the other. At issue is an attempt to weaken the Supreme Court power of declaring laws unconstitutional that it finds unreasonable [Basic Law]. If Court strikes down the power Netanyahu seeks, can a crisis still be averted by some compromise?",comment_2,"The court is hearing arguments for and against the first part of Netanyahu’s judicial overhaul plan to pass parliament – a law that restricts the court’s ability to nullify government actions it deems “unreasonable.”
 

 In a historic first, all 15 judges on the court have been convened to hear the challenge to the controversial law, which is expected to last no longer than a couple of days. The court must issue its ruling by January 12, 2024, because of a retirement coming up on the bench.
 

 Like the United Kingdom, Israel doesn’t have a written constitution. Instead, it relies on 13 Basic Laws, as well as court ruling precedents that could one day become a constitution. 
 

 Some scholars say the new law at issue Tuesday is an amendment to what in Israel is called a basic law, which has a special, quasi-constitutional status. Striking down the legislation would be akin to the court striking down a constitutional amendment possibly leading to a constitutional crisis.
 

 Others believe a compromise is likely because the risks caused by a constitutional crisis will neither help the Supreme Court not the Government. 
 

 [https://main.knesset.gov.il/EN/activity/documents/BasicLawsPDF/BasicLawTheJudiciary.pdf](https://main.knesset.gov.il/EN/activity/documents/BasicLawsPDF/BasicLawTheJudiciary.pdf)
 

 [https://time.com/6313113/israel-supreme-court-judicial-overhaul/](https://time.com/6313113/israel-supreme-court-judicial-overhaul/)
 

 If Court strikes down the power Netanyahu seeks, can a crisis still be averted by some compromise?","[A reminder for everyone](https://www.reddit.com/r/PoliticalDiscussion/comments/4479er/rules_explanations_and_reminders/). This is a subreddit for genuine discussion:
 

 * Please keep it civil. Report rulebreaking comments for moderator review.
 * Don't post low effort comments like joke threads, memes, slogans, or links without context.
 * Help prevent this subreddit from becoming an echo chamber. Please don't downvote comments with which you disagree.
 

 Violators will be fed to the bear.
 

 ---
 

 *I am a bot, and this action was performed automatically. Please [contact the moderators of this subreddit](/message/compose/?to=/r/PoliticalDiscussion) if you have any questions or concerns.*",">Like the United Kingdom, Israel doesn’t have a written constitution.
 

 Oh shit. 
 

 Well, good luck, Israel.",,,Condescending Attitude,,Neutral
results/Libertarian/,How do you debunk a socialist's definition of socialism?,comment_2,"We say that socialism is when the means of production are owned by the state, but many socialists say socialism is when the workers own the means of production. How do you debunk their definition?","You don't, don't engage with them. Socialists are fucking idiots.
 

 Socialism has failed, disastrously, in 100% of implementations. If they still insist on pushing it, they're pants-on-head morons and cannot be reasoned with.
 

 You can quickly debunk Socialism as pro liberty like this:
 

 * Under Capitalism, you can have socialism. A group of people can voluntarily join together, form a co-op, and live as socialists.
 * Under Socialism, you cannot be a capitalist. You are legally prohibited from starting a private company, even if you would be the bets leader for it and run it better than a co-op.
 

 Because of this simple truth, Capitalism is inherently more liberty friendly than socialism. And when given the choice, people always choose capitalism.
 

 Remember we had a literal head-2-head match. Two countries, both at equal starting points, with the same culture, but one was capitalist and one was socialist. 
 

 Which one built the Berlin wall to keep people from fleeing to the other?","""Can you give me an example of where the workers owned the means?"" and then just beat them with your knowledge of history.",,,,,Neutral
results/PoliticalDiscussion/,"Pence raises less than $1.2 million during second fundraising quarter, lagging behind GOP rivals .. what do you think about what s going on ?",comment_2,"Former Vice President Mike Pence raised less than $1.2 million for his presidential campaign during the second fundraising quarter that ended June 30, according to a Pence adviser, lagging far behind several Republican rivals who have announced much larger fundraising hauls and signaling potential struggles ahead to finance his White House bid.
 

 Pence entered the 2024 race the first week of June, with a little more than three weeks left in the fundraising quarter.
 

 His campaign did not say whether it had reached the donor threshold to qualify for the first GOP presidential debate, which the Republican National Committee set at 40,000 unique donors, including at least 200 per state or territory in 20 or more states and/or territories. 
 

 Source 
 

 https://edition.cnn.com/2023/07/14/politics/mike-pence-fundraising-republican-primary/index.html","[A reminder for everyone](https://www.reddit.com/r/PoliticalDiscussion/comments/4479er/rules_explanations_and_reminders/). This is a subreddit for genuine discussion:
 

 * Please keep it civil. Report rulebreaking comments for moderator review.
 * Don't post low effort comments like joke threads, memes, slogans, or links without context.
 * Help prevent this subreddit from becoming an echo chamber. Please don't downvote comments with which you disagree.
 

 Violators will be fed to the bear.
 

 ---
 

 *I am a bot, and this action was performed automatically. Please [contact the moderators of this subreddit](/message/compose/?to=/r/PoliticalDiscussion) if you have any questions or concerns.*","I think he should be able to use that money for a brain scan. There is no possible way he thinks he has a snowballs chance in hell of winning the nomination.
 

 I mean have they showed him the videos yet? The ones where tens of thousands of people were storming the capital to kill him?
 

 He's not going to win any Democratic support and clearly he's hated by the right. He's wasting his time.",Condescending Attitude,,Ad Hominem,"Acknowledges Personal Beliefs,Close-minded Absolutism,Condescending Attitude",IA
results/Conservative/,UK: Birmingham’s Green Lane Mosque on how to stone a woman to death.,comment_2,"UK: Birmingham's Green Lane Mosque on how to stone a woman to death.
 ""You must first bury her up to her waist to preserve her modesty""
 The British government has just given this mosque a £2.2 mn grant for ""youth services"".",I head this dude had to put down one of his 30 wives because he caught it eating grass out of another mans hand.,"Repulsive, backward political movement disguising itself as a religion.",Polarizing or Tribalistic Language,Condescending Attitude,,"Polarizing or Tribalistic Language,Condescending Attitude",IA
results/PoliticalDiscussion/,Is there any point in being an independent?,comment_2,"I was discussing with some people about politics and noted that I was an independent. I’m independent because I like to see the logical side of an argument and know that neither party is always right in every situation. However someone made a good point by saying there is no point in being independent because even if you vote for someone who you agree with on certain standpoints, you are basically voting for all the ideas of their party, even the ones that you don’t agree with. Is this true?","[A reminder for everyone](https://www.reddit.com/r/PoliticalDiscussion/comments/4479er/rules_explanations_and_reminders/). This is a subreddit for genuine discussion:
 

 * Please keep it civil. Report rulebreaking comments for moderator review.
 * Don't post low effort comments like joke threads, memes, slogans, or links without context.
 * Help prevent this subreddit from becoming an echo chamber. Please don't downvote comments with which you disagree.
 

 Violators will be fed to the bear.
 

 ---
 

 *I am a bot, and this action was performed automatically. Please [contact the moderators of this subreddit](/message/compose/?to=/r/PoliticalDiscussion) if you have any questions or concerns.*",Which I gotta add seems weird to me in this day and age when we have one party being led by a criminal trying to break our democracy and another party that's trying to stop him.,"Acknowledges Personal Beliefs, Polarizing or Tribalistic Language",,Polarizing or Tribalistic Language,Polarizing or Tribalistic Language,IA
results/Libertarian/,Governments criminalization of drugs cause crimes - not drug addicts.,comment_2,"Interesting discussion I read in the book: ""Defending the Undefendable"".
 

 Governments criminalize substances, example heroin. This causes all sorts of problems for the heroin market, the cost and risks to the manufacturer skyrocket from transportion, bribery, employees, clandestine facilities, obtaining the materials, etc. Now a drug, that is actually quiet cheap and would cost an addict the equivalent of a generic Advil pill at a pharmacy now costs hundreds of dollars per fix.
 

 If Heroin was legal, the addict could support his addiction for next to nothing as the product was cheap and abundant. With it being illegal and the prices astronomical the addict must commit continuous crimes ie: theft to obtain their fix.
 

 TLDR: By banning a substances, government forces addicts to criminality due to astronomical prices.","This is the kind of argument that has created the chaos in West Coast cities, “if there are no cops, then…” it’s a backwards approach at Philosophy that betrays a key misunderstanding of human nature.",I mostly agree...,"Acknowledges Personal Beliefs, Overinflated Expertise","Overinflated Expertise,Acknowledges Personal Beliefs",,Acknowledges Personal Beliefs,IH
results/Conservative/,Looking for UK-based conservative YT channels,comment_2,"Hi all, as stated in my title, I'm trying to compile a list. I'll start:
 

 GBNews
 

 UnHerd
 

 The New Culture Forum
 

 Michael Heaver
 

 Pat Condell",Lotus eaters,Paul Joseph Watson and Anything Goes,,,,,Neutral
results/Libertarian/,Hello from the Kennedy camp...,comment_2,"Hi everyone, I am for Robert F. Kennedy Jr. for President in 2024, and I am not sure if you guys have noticed or not, but the DNC has been treating my candidate all wrong. It has the wrong tone, and its just plain WRONG. They are now basically telling him he cannot win a Democratic Primary unless he gets 80% of the vote... My question to you all is... What is the Libertarian Party about and is there a place in the party and on the ticket for him as a Libertarian Candidate. Thanks in advance. - Team Kennedy Indiana 
 

 [View Poll](https://www.reddit.com/poll/16dq77k)","There is a lot of good to like about RFKJ, but he's also just not a libertarian. He's great for a democrat and I really wish him well there. Hopefully he can help represent a resurgence of the millions of sane democrats. He would be welcome as a collaborator and coalition builder with libertarians on various issues. But he will not have success as the Libertarian party presidential candidate.",He’s a little too conspiracy theorist for me. We need someone that operates on facts.,"Acknowledges Personal Beliefs, Condescending Attitude",,,Acknowledges Personal Beliefs,IH
results/Conservative/,The case against pets: is it time to give up our cats and dogs?,comment_1,You will own nothing and be happy 😔,The case against joy: how can leftists make everyone as miserable as them?,"One of the earliest traces of mankind dates back to about 40,000 BC. It is of a boy's and a puppy's prints walking together in a cave. So, the answer to the Guardian is no; never.",Condescending Attitude,Ad Hominem,,Condescending Attitude,IA
results/Libertarian/,Liberalism or Sharia?,comment_2,"Liberalism - allows the existence of Sharia. But Sharia does not allow the existence of liberalism, LGBT, tolerance.",Can you stop posting shit with clear ulterior motives,"Yeah, just historically, you might not want to poke the German bear when it comes to the purity of their bloodlines and culture.",,,,,Neutral
results/Conservative/,So what does this mean for me?,comment_1,"I saw somebody take a test like this so I wanted to do something similar. From what I see I'm pretty moderate on most things except for the Federal axis, what does that mean?",Ooh where is that quiz,The American values test 2,,Seeks out new information,,Seeks out new information,IH
results/PoliticalDiscussion/,What if patents were limited?,comment_2,"Patents allow companies to engage in price gouging and the price of drugs falls by 90% when they come off of patent. 
 

 The flip side is that older drugs that did the same jobs as the now patented drug stop getting produced, so the consumer is on the hook for expensive drugs all the time. 
 

 On another side, drug pricing is a black box. Nobody knows how companies make the price determinations that they do. its certainly not driven by cost of production. And its not driven by total cost of research for that specific drug. 
 

 So what if drug patents came with strings attached? For example, the patent expires after it makes 5x the amount of money put into R&D, or if the company spends less than 70% of its total budget on research and production of drugs (for example paying the ceo exorbitant salaries or running ad campaigns) they stand to lose their patents.","[A reminder for everyone](https://www.reddit.com/r/PoliticalDiscussion/comments/4479er/rules_explanations_and_reminders/). This is a subreddit for genuine discussion:
 

 * Please keep it civil. Report rulebreaking comments for moderator review.
 * Don't post low effort comments like joke threads, memes, slogans, or links without context.
 * Help prevent this subreddit from becoming an echo chamber. Please don't downvote comments with which you disagree.
 

 Violators will be fed to the bear.
 

 ---
 

 *I am a bot, and this action was performed automatically. Please [contact the moderators of this subreddit](/message/compose/?to=/r/PoliticalDiscussion) if you have any questions or concerns.*","You won't be able to do it without micromanaging the industry. Patents do have expiration dates, and there are exceptions to when they can be used. They are important because without them it would be a losing bet to do R&D, since as soon as you're done someone else will put out the same product without spending the cost/effort. How much return on R&D is worth it a company to spend? Hard to say, and probably varies case by case. There's also the cost of regulatory compliance with bringing new drugs to market which is extraordinary, something like a couple billion dollars and decade on average.",,,Recognizes limitations in ones own knowledge or beliefs,,Neutral
results/Conservative/,My dad died. I sat around and watched. It was awful. I miss him...,comment_1,"Can I make this self post here? It's kind of pointless I guess -- we all lose our Dads and we all are sad. It's not conservative really. I just wanted to discharge my emotions a bit...
 

 Hug your Dads.",So sorry for your loss.,Really sorry man. Hope you're ok.,,,Displays Empathy,Displays Empathy,IH
results/conservatives/,"NEW - Greece has called out ""arsonist scum"" after police made 79 arson arrests over wildfires ravaging the country.",comment_2,https://www.disclose.tv/id/977m9mzn3c/,What I'd like to know is who is behind this. There are too many of them for it to not be coordinated.,Can you say Soros and WEF?,,,,,Neutral
results/Conservative/,Powerful picture,comment_2,Bless this little girls heart this is the most powerful picture I’ve ever seen in years,Keep that kid away from Democrats or she'll be scarred for life.,"Bless her, God protect her from the pedophiles and lefties",Polarizing or Tribalistic Language,,,Polarizing or Tribalistic Language,IA
