subreddit,thread_title,focal_post,submission_text,comment_1,comment_2,coder1,coder2,coder3,training_label,classification
results/PoliticalDiscussion/,Do you think that a line item veto is a good idea?,comment_2,"Most governors have this power. Not to the extent of Wisconsin where the governor managed to creatively secure education funding through to 2425. But still, some kind of line item veto. 
 

 I imagine the veto a president might have would state numbered or lettered sections of the bill in question, and probably also the power to reduce spending but not all the way to 0 on a given thing. 
 

 The Congress right now is getting into headaches where they have all kind of riders in the bill that might not be such a good thing overall and would never pass as legislation in their own right or where legislators demand that some project be done in a specific manner that is overly parochial as part of the funding bill, knowing that it is one of the few bills that avoids a filibuster and must be passed in some form last a shutdown occur.","[A reminder for everyone](https://www.reddit.com/r/PoliticalDiscussion/comments/4479er/rules_explanations_and_reminders/). This is a subreddit for genuine discussion:
 

 * Please keep it civil. Report rulebreaking comments for moderator review.
 * Don't post low effort comments like joke threads, memes, slogans, or links without context.
 * Help prevent this subreddit from becoming an echo chamber. Please don't downvote comments with which you disagree.
 

 Violators will be fed to the bear.
 

 ---
 

 *I am a bot, and this action was performed automatically. Please [contact the moderators of this subreddit](/message/compose/?to=/r/PoliticalDiscussion) if you have any questions or concerns.*","Seems like its way too great a power for the president. We could end up just having the exact worst scenario, with a president vetoing all the substance of a bill and only letting the unpopular riders pass. 
 

 A real solution would be voiding the filibuster. Right now, most riders are all about whipping up bipartisan support for bills.",,,,,Neutral
results/conservatives/,"Outrageous! Border Patrol Agent Reveals Biden Regime Gives $2,200 of Taxpayer Money Per Illegal Immigrant Family, Plus a Plane Ticket, Housing, Food, Free Medical Services (VIDEO)",comment_1,https://click1.e.westernjournalism.com/njrprcgthdcnrcpbntwqcncqcwnwjmfgjgdkwpmydyrjwqr_rklkktcjvvpcvlkcjnjjj.html,"Gee. I wonder why we have an ""undocumented migrant"" problem.","There's a second layer of spending by organizations like the Red Cross that use their funds to pay for support, supplies and services for illegals. Donations to non-profits like the ARC are fungible, no matter what they say in the ads.",,,,,Neutral
results/PoliticalDiscussion/,Is it better to win by compromising your redlines? Or risk losing but holding on to your values?,comment_2,"Here at reddit and all over social media, we see sentences like this:
 

 

 

 

 

 

 

 

 

 

 

 

 

 

 

 

 ""I love Bernie Sanders but he will never win. He is too leftist. We need undecided votes. We need someone from the center""
 

 Or
 

 

 

 ""Who you gonna change anything if you don't win?""
 

 

 

 

 Or 
 

 

 

 

 

 ""Mr x is a corrupt politician. But he votes with democrats. We need him so republicans don't win. No one else can win for us""
 

 

 

 

 

 

 

 Or 
 

 

 

 

 

 

 

 

 ""Biden cannot pass x if he doesn't compromise against republican demands.
 So it is okay to waterdown x to the point of being meaningless.""
 

 

 

 

 

 

 

 

 

 

 

 

 

 

 

 

 As someone living outside the US, I found it strange that almost no one talks about a party's credibility among voters. Which is usually related to how they delivered on their promises historically. 
 

 

 

 

 

 

 

 

 

 

 

 

 

 

 

 

 Do you think it worth winning but losing your popularity long term? 
 To what extent we should ""compromise"" to win elections?
 And finally, can it be the reason why so many people don't trust neither party and many other don't vote?","[A reminder for everyone](https://www.reddit.com/r/PoliticalDiscussion/comments/4479er/rules_explanations_and_reminders/). This is a subreddit for genuine discussion:
 

 * Please keep it civil. Report rulebreaking comments for moderator review.
 * Don't post low effort comments like joke threads, memes, slogans, or links without context.
 * Help prevent this subreddit from becoming an echo chamber. Please don't downvote comments with which you disagree.
 

 Violators will be fed to the bear.
 

 ---
 

 *I am a bot, and this action was performed automatically. Please [contact the moderators of this subreddit](/message/compose/?to=/r/PoliticalDiscussion) if you have any questions or concerns.*",Both parties seem oblivious to how easy it would be win the general if they ran someone closer to center. So I'd say most people value cherishing their redlines over steering the ship.,Acknowledges Personal Beliefs,Acknowledges Personal Beliefs,,Acknowledges Personal Beliefs,IH
results/Liberal/,Wow...New Hampshire of all places..,comment_2,Living here I get to see the MAGA cult up close everyday..this surprised me and I know it will not go over well here.,Now let’s get started in the other 49 states,Good for New Hampshire.They are showing the courage that I hope other states will show.Don’t be intimidated by MAGA.Do what’s right.,"Acknowledges Personal Beliefs, Polarizing or Tribalistic Language",,,Acknowledges Personal Beliefs,IH
results/conservatives/,Police: 5-year-old Indiana boy high on cocaine fatally shoots 16-month-old brother high on marijuana,comment_1,"The boys' parents now facing multiple criminal charges, including neglect and drug offenses
 

 https://www.washingtontimes.com/news/2023/jul/27/police-5-year-old-indiana-boy-high-cocaine-fatally/#cxrecs_s","Let me guess, guns are the problem, right?",Close. It's actually straight white men.,Condescending Attitude,,,Condescending Attitude,IA
results/Libertarian/,My dad thinks that Calvin Coolidge is an average president.,comment_1,"Apparently, he doesn’t think that he’s as good as Reagan or Trump since Coolidge doesn’t have much laws in the U.S. and that Coolidge policies of less laws may have contributed to the Great Depression. I guess that proves that my dad is no libertarian. Can you believe this? Even though Coolidge is considered to be the most libertarian president in history.","Lol, Coolidge was a fucking joke and an unmitigated disaster. His policies created Black Tuesday. He got us Hoover and FDR. 
 

 BTW, Andrew Jackson is the most libertarian president ever. He ended the Fed. He balanced the budget and paid off the debt (the last time we were in the black). He handled the South Carolina secession crisis with skill. He weakened the federal government's power, and he significantly decreased the amount of corruption in the federal government. He did advocate for high tariffs but reversed course when the people didn't support him.","If you think Coolidge, rather than the Federal Reserve, created Black Tuesday, you might have no clue what the Austrian Business Cycle Theory is.
 

 In Austria, economist Ludwig von Mises saw the problem developing in its early stages and predicted to his colleagues in 1924 that the large Austrian bank, Credit Anstalt, would eventually crash. He wrote a full analysis of Irving Fisher’s monetary views, published in 1928, where he targeted Fisher’s reliance on price indexes as a key vulnerability that would bring about the Great Depression, concluding: ""because of the imperfection of the index number, these calculations would necessarily lead in time to errors of very considerable proportions.""
 

 F. A. Hayek published several articles in early 1929 in which he predicted the collapse of the American boom. Felix Somary, who like Mises was a student at the University of Vienna, issued several dire warnings in the late 1920s.
 

 In America economists Benjamin Anderson and E.C. Harwood also warned that the Federal Reserve policies would cause a crisis, and like Somary, they were largely ignored. Albert H. Wiggin summed up in 1931 that the ""depression has been prolonged and not alleviated by delay in making necessary readjustments.""
 

 From June 1914 to January 1920, when demand deposits grew by 96.9 percent, time deposits rose by 126.1 percent. In the great boom of the 1920s, that started after the recession of 1920–21 (a short recession, thanks to the budget cutting and lowering of taxes by Warren Harding), total demand deposits rose from 1921 to 1929 by 36.5 percent. Time deposits in banks expanded in the same period by 75.9 percent. The great boom of the 1920s was largely fueled by credit expansion going into time deposits. The greatest expansion of time deposits came in Central Reserve Cities (New York and Chicago), where the Fed’s open market operations were all conducted, as opposed to Reserve Cities and Country Banks. As acknowledged by Federal Reserve officials, time or savings deposits were then, for all practical purposes, equivalent to demand deposits and should be paid on demand in case of a run on a bank.
 

 With the passage of the Federal Reserve Act, President Wilson appointed Benjamin Strong to the most powerful post in the Federal Reserve System, Governor of the Federal Reserve Bank of New York. He made quickly this position dominant in the System and decided on Fed policy without consulting or even against the wishes of the Federal Reserve Board in Washington. Strong was the dominant leader of the Fed from 1914 until his death in 1928. He pursued an inflationary policy, to finance the war effort for WWI, connected to the interests of the House of Morgan. Another motivation was the attempt to prop up the Bank of England in the 1920s, when it returned to the gold standard with an overvalued pound. To prevent the loss of gold to the States, its governor Montagu Norman secretly convinced Strong to inflate in order to help England. The expansion ended only after Strong's death and the Great Depression followed soon after. In 1928 Strong admitted that ""very few people indeed realized that we were now paying the penalty for the decision which was reached early in 1924 to help the rest of the world back to a sound financial and monetary basis"" - that is, to help Britain maintain a phony and inflationary form of gold standard.
 

 The inflation was also motivated by a desire to help American exporters (particularly farmers), by stimulation of foreign lending. At the same time the U.S. turned to a sharp protectionist policy with the Fordney–McCumber Tariff of 1922. In the foreign lending boom, other countries were hampered in trying to sell their goods to the United States, but were encouraged to borrow dollars. The government did not have any peacetime authority to interfere with loans, but did so illegally. In 1921, President Harding and his cabinet conferred with several American investment bankers, at the instigation of Secretary of Commerce Hoover, to be informed in advance of foreign loans, so that the government ""might express itself regarding them"". The bankers agreed. Hoover commented that even bad loans helped American exports and provided a cheap form of relief and employment. Later Hoover demanded from bankers, that foreign loans would be inspected by agents of the Department of Commerce. Both requests were mostly ignored. While admitted to be legally unenforceable, it was all in the name of ""national interests"".
 

 This particular stock-market correction was bound to be severe because of the unprecedented amount of speculation. In 1929 1,548,707 customers had accounts with America's 29 stock-exchanges. In a population of 120 million, nearly 30 million families had an active association with the market, and a million investors could be called speculators. Moreover, of these nearly two-thirds, or 600,000, were trading on margin, that is on funds they either did not possess or could not easily produce.
 The danger of this growth in margin trading was compounded by the mushrooming of investment trusts which marked the last phase of the bull market. Traditionally stocks were valued at about 10 times earnings. With high margin trading, earnings on shares, only one or two per cent, were far less than the eight to ten percent interest on loans used to buy them. This meant that any profits were in capital gains alone. Thus, Radio Corporation of America, which had never paid a dividend at all, went from 85 to 410 points in 1928. By 1929 some stocks were selling at 50 times earnings. A market boom based entirely on capital gains is merely a form of pyramid-selling.
 

 By the end of 1928 the new investment trusts were coming onto the market at the rate of one a day and virtually all were archetype inverted pyramids. They had ""high leverage""—a new term in 1929—through their own supposedly shrewd investments, and secured phenomenal stock exchange growth on the basis of a very small plinth of real growth. United Founders Corporation, for instance, had been created by a bankrupt with an investment of $500, and by 1929 its nominal resources, which determined its share price, were listed as $686,165,000. Another investment trust had a market value of over a billion dollars but its chief asset was an electric company which in 1921 had been worth only $6 million. These crazy trusts, whose assets were almost entirely dubious paper, gave the boom an additional superstructure of pure speculation, and once the market broke the ""high leverage"" worked in reverse.
 

 The economy ceased to expand in June, and it was inevitable that this change in the real economy would be reflected in the stock market. The bull market effectively came to an end on Sept 3, 1929, immediately the shrewder operators returned from vacation and looked hard at the underlying figures. Later rises were merely hiccups in a steady downward trend.
 

 On Monday Oct 9, for the first time, the ticker-tape could not keep pace with the news of falls and never caught up. Margin calls had begun to go out by telegram the Saturday before, and by the beginning of the week speculators began to realize they might lose their savings and even their homes. On Thursday, Oct 12, shares dropped vertically with no one buying and speculators were sold out as they failed to respond to margin calls. Then came Black Tuesday, Oct 19, and the first selling of sound stocks to raise desperately needed liquidity.",,"Close-minded Absolutism,Condescending Attitude",,Close-minded Absolutism,IA
results/Libertarian/,Should all education be private?,comment_1,Why or why not?,No. We should retain a Army and Navy war academy.,"Yes. The primary rationale for public schooling was that the (non-religious) private sector was unable to provide the service. Now we know that public education cannot provide a non-religious education, while the private sector can.",,,,,Neutral
results/Conservative/,"CDC Backs 'Chestfeeding,' Accused of Ignoring Risk to Infants",comment_1,“I have a nipple Greg could you milk me”. The insanity has to stop now they are going to harm children because some idiot is going to believe this.,We’re an evil nation.,"Does anyone remember that part of 1984 where that one guy said if Big Brother said he had started flying, everyone would believe it as if it had actually happened?",,,,,Neutral
results/Libertarian/,Leftist oppositon candidate to Milei insults the poor for voting for Milei [leaked audio],comment_1,"Video taken from IG account ""facurobledo.ok""",When the gravy train runs out,In America that is the standard white savior complex liberal,,,,,Neutral
results/Conservative/,How is not securing the border not considered treason for our elected officials?,comment_2,"""Whoever, owing allegiance to the United States, levies war against them or adheres to their enemies, giving them aid and comfort within the United States or elsewhere, is guilty of treason and shall suffer death, or shall be imprisoned not less than five years and fined under this title but not less than $10,000; and shall be incapable of holding any office under the United States.”","Are you suggesting that the U.S. currently labels Mexico and Venezuela as enemies of the U.S.? I really don't like what is happening at the border right now, but what you're quoting doesn't share context.","An open border allows anyone to come in, friends or enemies.",,,,,Neutral
results/conservatives/,JESSE WATTERS: The Biden family may have offshore bank accounts Watters breaks down new allegations iin the Hunter Biden case,comment_1,https://www.foxnews.com/media/jesse-watters-biden-family-may-have-offshore-bank-accounts,The “there’s no evidence” talking point is all libs can say. Talk about cognitive dissonance. There’s evidence everywhere.,The evidence and allegations are piling up. The walls are closing in so Biden goes to the beach. Good plan JOE,,,,,Neutral
results/Libertarian/,"Newbie Question: Who are some thinkers and/or debates where the main ideas of Libertarianism are contrasted with the ideas of Conservatism in regards to ""Personal Freedom.""",comment_2,"Hey guys,
 

 It seems Conservatism and Libertarianism are similar in that both believe in Market Freedom. However, Libertarians believe in ""Personal Freedom."" Meanwhile, most Conservatives opposes Personal Freedom over an emphasis on ""Traditional Values."" 
 

 David Nolan talks about this topics on his Nolan Chart. However, I'd like to hear more thinkers and debates that delve deeper into this concept of ""Personal Freedom."" Especially comparing and contrasting Libertarian with Conservative thought.","**New to libertarianism or have questions and want to learn more?** Be sure to check out [the sub Frequently Asked Questions](/r/Libertarian/wiki/faq) and [the massive /r/libertarian information WIKI] (/r/Libertarian/wiki/index) from the sidebar, for lots of info and free resources, links, books, videos, and answers to common questions and topics. Want to know if you are a Libertarian? [Take the worlds shortest political quiz and find out!](http://www.theadvocates.org/)
 

 *I am a bot, and this action was performed automatically. Please [contact the moderators of this subreddit](/message/compose/?to=/r/Libertarian) if you have any questions or concerns.*","Many conservatives seem to be very comfortable with trade protectionism, the war on drugs, mandatory conscription, death penalty, etc",,,,,Neutral
results/PoliticalDiscussion/,What would happen to the Republican Party if Donald Trump wins the 2024 presidential nomination but loses the general election by a slightly smaller margin than 20202?,comment_2,"Let's assume he wins the nomination convincingly and then loses the election against Biden by a relatively close margin in the electoral college, like maybe a little closer than last time (imagine a map similar to 2020 but with GA and AZ flipped back to red). Let's assume that just like in 2020, Trump refuses to concede and claims that Biden's win was fraudulent.
 

 This scenario is very plausible given polling data and yet is often underdiscussed perhaps because it seems rather mundane, but it's actually pretty interesting to imagine what the fallout would be for the GOP after that. Would the conservative base really take that as a rebuke of Trump, especially if he did indeed perform better than 2020? Or would they simply add to the narrative of massive election fraud like with 2020?  
 

 Imagine Trump doesn't die or get seriously ill and also that none of his various legal cases end with jail time, would Trump be the frontrunner in 2028 if he decided to run again?","[A reminder for everyone](https://www.reddit.com/r/PoliticalDiscussion/comments/4479er/rules_explanations_and_reminders/). This is a subreddit for genuine discussion:
 

 * Please keep it civil. Report rulebreaking comments for moderator review.
 * Don't post low effort comments like joke threads, memes, slogans, or links without context.
 * Help prevent this subreddit from becoming an echo chamber. Please don't downvote comments with which you disagree.
 

 Violators will be fed to the bear.
 

 ---
 

 *I am a bot, and this action was performed automatically. Please [contact the moderators of this subreddit](/message/compose/?to=/r/PoliticalDiscussion) if you have any questions or concerns.*","Nah.
 

 If it's Trump v. Biden-- Biden wins more decisively than 2020. Trump isolated the principled Republican voters and people are going to remember how much they didn't want to hear about Trump all of the darnn time. Biden is palatable for moderates, and independents. Trump is not going to pick up any of the purple states, etc.
 

 If there is one candidate who is going to drive turn outs for the democrats, it's Trump.
 

 If it is anyone else v. Biden, all bets are off. Especially if the GOP nominee is somewhat sane.",,Close-minded Absolutism,,Close-minded Absolutism,IA
results/Conservative/,So... yeah. This is a thing the CIA did and got away with.,comment_1,"I have not read all the reports. But, if you ever wondered if our nation was filled with truly evil people. No one was charged or arrested and it was all covered up.",already 100% confident that I'm happier not reading the rest.,"But yeah, normalcy bias gets in the way.
 

 ""Nahhh, they'd never do that to us""",,Close-minded Absolutism,Acknowledges Personal Beliefs,Close-minded Absolutism,IA
results/PoliticalDiscussion/,Age limits for elected officials,comment_2,"Given Feinstein's death it seems an apropos time for the discussion:
 

 Should we enact age limits for elected officials, Senators, even Presidents?
 

 Cons:
 

 The founders did not see this as an issue, however modern medicine has extended the lifespan to the point that dementia and other incapacitating illnesses are common comorbid causes of death.
 

 This would likely require a constitutional amendment.
 

 Pros:
 

 The government might be more responsive to its population, given elected officials might feel less insulated by power.","[A reminder for everyone](https://www.reddit.com/r/PoliticalDiscussion/comments/4479er/rules_explanations_and_reminders/). This is a subreddit for genuine discussion:
 

 * Please keep it civil. Report rulebreaking comments for moderator review.
 * Don't post low effort comments like joke threads, memes, slogans, or links without context.
 * Help prevent this subreddit from becoming an echo chamber. Please don't downvote comments with which you disagree.
 

 Violators will be fed to the bear.
 

 ---
 

 *I am a bot, and this action was performed automatically. Please [contact the moderators of this subreddit](/message/compose/?to=/r/PoliticalDiscussion) if you have any questions or concerns.*","Yes, a thousand times yes.  
 Feinstein was a great leader, but her legacy is tarnished by the last few years where she clearly had no business being in the Senate or a City Council. And where TF were the adults in the room. She was the mayor of SF, had she no gay friends to tell her ""gurl, get off the stage"".  
 

 I'm 74 and in pretty good health, still have most of my mental capacity but I often struggle to find that elusive word that I know that I know but somehow can't remember it. Grassley, Biden, Pelosi, Trump, they all need to get out of the way. But none of them are patriots just people clinging to the power that defines them.","Acknowledges Personal Beliefs, Polarizing or Tribalistic Language",,"Acknowledges Personal Beliefs,Engages Respectfully with Diverse Perspectives",Acknowledges Personal Beliefs,IH
results/Libertarian/,What would be the ideal situation for roads for a libertarians?,comment_2,"Should roads be privatized? I feel like it would be a bit extreme if all roads were privatized.
 

 In Toronto, the 407 (private) is a way better experience than the 401 (public) so I do see why some private in the road network is good.","As much as possible (can still be collectively run by private communities), but the concept of a *right-to-travel* needs to be addressed. Otherwise entities could literally imprison people on their respective property.",Not a bad idea. Could at least have two options. Dirt road or toll road.,,,Engages Respectfully with Diverse Perspectives,,Neutral
results/PoliticalDiscussion/,How likely is the threat of a genocide in the united states? What can be done to prevent one?,comment_2,"Individuals calling for the wiping out of various groups are becoming more vocal in the united states. How seriously should those people be taken as a threat? If one of them did manage to take power, do you think they would actually be able to start a genocide, or are there measures in place that would slow or prevent that? What can be done to prevent the threat of a genocide?","[A reminder for everyone](https://www.reddit.com/r/PoliticalDiscussion/comments/4479er/rules_explanations_and_reminders/). This is a subreddit for genuine discussion:
 

 * Please keep it civil. Report rulebreaking comments for moderator review.
 * Don't post low effort comments like joke threads, memes, slogans, or links without context.
 * Help prevent this subreddit from becoming an echo chamber. Please don't downvote comments with which you disagree.
 

 Violators will be fed to the bear.
 

 ---
 

 *I am a bot, and this action was performed automatically. Please [contact the moderators of this subreddit](/message/compose/?to=/r/PoliticalDiscussion) if you have any questions or concerns.*","This is why a limited government is important. but no, like, those people live in fantasy land",,,,,Neutral
