subreddit,thread_title,focal_post,submission_text,comment_1,comment_2,coder1,coder2,coder3,training_label,classification
results/Libertarian/,"A question I think we should ask ourselves, on the nature of pragmatism vs idealism",comment_2,"Ok so for context, I am on the libertarian spectrum, I am not an anarchist. I wouldn't *hate* the label of minarchist, because I basically think a strong military, criminal justice court, borders, and foreign policy/military alliances is the role of the state, and open to frameworks with a bit more or less than that, essentially, I am one of you, but I just don't feel confident in putting an exact label on my SPECIFIC ideology within libertarianism.
 

 Essentially, the idea of ""I am open to compromising"" lead me to a certain question, and this is going to be a question more important for the people on the anarchy and minarchy side of things.
 

 It is clear, to me, personally, that people don't ACTUALLY usually value freedom as a primary value above others. They, to an extent, want a certain level of authoritative figure. The ""order"" of the state, the safety net, the idea that there's a ""higher power"" (sound familiar) to watch out for you and be tooootally benevolent!
 

 Due to this, I think it is clear that ancapistan will simply just not be achieved on a large scale because people who value freedom above all are actually incredibly rare. So my question to you is, to what extent should we be willing to sacrifice our ideals to make pragmatic progress to our political system?
 

 I feel like inherently, libertarians tend to value deontological ethics more and socialists consequentialist, so to an extent, it goes against our deontological leanings to suggest we sacrifice our ideal vision of the future for pragmatic improvement, but yet, if we think the people will never share our vision and we aren't interested in violent revolution (I am absolutely not in favor of political violence) then we should probably try to IMPROVE the situation even if we can't completely fix it.
 

 So my question to you is, to what extent can we sacrifice our full ethics to throw our support behind a figure for change? Many of us believe coercion and taxation is always theft and bad, for example, or that violations of ANY civil liberties is a great injustice, and to an extent I agree, but in a world where complete freedom is unlikely, we should ask...
 

 What are our priorities? What is the exact minimum requirement of ""pro-liberty"" a political candidate or movement must meet before we should feel confident in throwing our full support behind it? Does such a limit exist, should we never fully support a movement that doesn't 100% agree with our values, should we be looking to compromise, or to never compromise?
 

 I am interested in hopefully some good discussion on this matter","**New to libertarianism or have questions and want to learn more?** Be sure to check out [the sub Frequently Asked Questions](/r/Libertarian/wiki/faq) and [the massive /r/libertarian information WIKI] (/r/Libertarian/wiki/index) from the sidebar, for lots of info and free resources, links, books, videos, and answers to common questions and topics. Want to know if you are a Libertarian? [Take the worlds shortest political quiz and find out!](http://www.theadvocates.org/)
 

 *I am a bot, and this action was performed automatically. Please [contact the moderators of this subreddit](/message/compose/?to=/r/Libertarian) if you have any questions or concerns.*","In my personal belief, I am willing to compromise out of my minarchist leanings into a classical libertarian type.
 

 I am leaning towards FIAT currency and inflationary policies being another form of theft and we should perhaps consider going away from this and maybe even de-centralizing banking, but I think these can be evils that can be lived with if the economy is generally healthy thanks to non-interference.
 

 If the candidate advocates for as little government influence as possible and genuinely tries to scale back and give us a true free market, then I can accept their views on the federal reserve either way.
 

 Obviously, our constitutional rights are non-negotiable. Speech, firearms, and the rest, infringement on ANY of these should be NON-NEGOTIABLE.
 

 In terms of civil liberties it is probably unlikely we see a politician that goes full ""Fully automatic cocaine farms are legal"", so it's hard for me to define what exactly I would like to see at a minimum, but I think in general someone that genuinely cares about our civil liberties and makes steps to improve our situation, even if not as drastic as that, I could put my support behind.
 

 Essentially, I am willing to compromise. One of the reasons I have not bothered fully solidifying and identifying my exact ideology is because I am, frankly, pessimistic on if we can achieve even the amount of minarchy I already advocate for, so perhaps my energy would be better focused on identifying pragmatic steps forward that could actually be likely, and then, maybe when these ideas become normalized, push the envelope a little more.
 

 What do you guys think? Is this a betrayal of values, or only logical?",,"Acknowledges Personal Beliefs,Reconsiders beliefs when presented with new evidence,Engages Respectfully with Diverse Perspectives,Recognizes limitations in ones own knowledge or beliefs,Seeks out new information","Acknowledges Personal Beliefs,Engages Respectfully with Diverse Perspectives,Seeks out new information,Recognizes limitations in ones own knowledge or beliefs","Acknowledges Personal Beliefs,Reconsiders beliefs when presented with new evidence,Engages Respectfully with Diverse Perspectives,Recognizes limitations in ones own knowledge or beliefs,Seeks out new information",IH
results/Libertarian/,Argentinian Teacher indoctrinates and insults young students out of anger because Milei won the primary elections,comment_2,"Video taken from Instagram account ""mileiaa.ok"". I only subtitled and translated it.","Translation mistake: where it reads ""their rights"" it should be ""your rights"".","""santa obligación"" - it indeed feels like a cult. The rights that actually matter (right to own guns, right to free speech and so on) are the ones that are actually absent.
 

 She acts as if she is caring for the student, but she's probably actually worried about herself and her future because there's a real chance that the state aristocracy is going to fall apart and their easy life funded by the increasingly scarce taxpayer money will be gone.
 

 **Not even Gorbachev, former leader of the Soviet union, had a livable pension after the collapse**.",,,,,Neutral
results/Conservative/,Could someone please help me find the video where Thomas Sowell explains how the Nazis are left leaning? I know I saw it before. Thanks in advance.,comment_2,It's a great video by Sowell. I don't know if it got taken down or not. Please help.,"You don’t need a video, they’re left leaning in the oversimplified “left right” economic scale by the simple fact alone that their government controls their economy.  
 

 No, they’re not socialist like many on here like to claim. 
 

 No, they’re certainly not communists, either. 
 

 But they’re definitely on the mid left side of the simple left right economic scale.","Dinesh D'souza did a whole documentary on how the Nazis borrowed many ideas from American progressives. 
 

 American Progressives were the world's biggest proponents of Eugenics until the Nazis over took them.
 

 Mussolini wrote the ""Doctrine of Fascism"" in it he describes how Fascism itself evolved out of socialism. Which isn't surprising for the man who coined the term ""Fascism"", he was a socialist his entire life up until that point. 
 

 To put simply, classical socialist literature typically pushed toward an idea of communism. Communism is a classless equal society where no one was more powerful or more wealthy than anyone else, which also included the abolishment of any and all government. But they realized it would be really hard to make such a society, so socialist literature held up an all powerful ""Transitory government"". This government would force people to behave correctly so that the utopia of communism could be possible. The goal being that once they had achieved ""equality"" the government would be abolished.
 

 Mussolini describes the Transitory Government as the final solution, not communism. The ""State"" was the embodiment of the ""collective"". The state was made up of the party and people, and thus it was more valuable than anything else. Everything in a Fascist society was of the interest of the state including property and children.
 

 This is why Communist countries, who were attempting to get to communism, looked a lot like Fascist states. They could never get past the Transitional Government. In part because their utopian idea was impossible also in part due to people not wanting to give up the power they had accumulated. It's not that they weren't ""true communism"", it's that they failed along the way.",,,,,Neutral
results/PoliticalDiscussion/,What is happening right now in the Republican Party?,comment_2,"Donald is so confident that he’s not bothering to debate his opponents while at the same time there are 93 felony counts against him across four cases brought in the last five months. His results in the last election, while hotly debated in some circles, were 232 electors to 306, the reverse of his ratio in 2016 when he won handily against Hillary Clinton.
 

 The new batch of candidates is a mix of former staffers like Nikki Haley, critics like his VP Mike Pence and Chris Christy, a tech CEO, and several state-level people that have little national recognition. Ron DeSantis would be the exception there, and while he is being sued, it’s only for his actions in official capacity as the Governor and there is no threat of jail time.
 

 Voter turnout in 2020 was up to 66% and the winner took home 81,283,098 votes, 51.3 percent of the votes cast. 46.8% went for the Republican candidate and that was a popular vote record beaten only by his opponent so it wasn’t a bad showing.
 

 What candidate can beat that if Donald is in prison and unable to run for President? All candidates with national experience are white, one is Nikki Haley and the rest are men over 60. Roe was overturned, 9 million more genZ voters are coming, and Covid was tough on the older generations. 
 

 Where does the party go from here?","[A reminder for everyone](https://www.reddit.com/r/PoliticalDiscussion/comments/4479er/rules_explanations_and_reminders/). This is a subreddit for genuine discussion:
 

 * Please keep it civil. Report rulebreaking comments for moderator review.
 * Don't post low effort comments like joke threads, memes, slogans, or links without context.
 * Help prevent this subreddit from becoming an echo chamber. Please don't downvote comments with which you disagree.
 

 Violators will be fed to the bear.
 

 ---
 

 *I am a bot, and this action was performed automatically. Please [contact the moderators of this subreddit](/message/compose/?to=/r/PoliticalDiscussion) if you have any questions or concerns.*","A party platform would be helpful (in theory) considering the last one was the 2012 post-mortem, that’s been thoroughly cremated since then.",,,,,Neutral
results/Libertarian/,Just saying ....,comment_2,"&#x200B;
 

 https://preview.redd.it/29lstqymk5kb1.png?width=828&format=png&auto=webp&s=0be51c1486105f7b8c6cf9bc96ed50e49b17b129",Yep. It's called cognitive bias.,"Who cares whether you got the shot or not? The issue was, and remains, all about government attempts to force you to get it.",,,,,Neutral
results/Libertarian/,Non-interventionist and WW2?,comment_2,"I'm all for intervention with world affairs but always struggle with WW2. The US interactions before, during, and after are hard to justify no-interventionism. 
 

 The treatment of the Axis powers to civilians are my general concerns are hard for me to justify to no introversion. I'd like some thoughts on this. 
 

 How does this compare to Libertarian stances?","**New to libertarianism or have questions and want to learn more?** Be sure to check out [the sub Frequently Asked Questions](/r/Libertarian/wiki/faq) and [the massive /r/libertarian information WIKI] (/r/Libertarian/wiki/index) from the sidebar, for lots of info and free resources, links, books, videos, and answers to common questions and topics. Want to know if you are a Libertarian? [Take the worlds shortest political quiz and find out!](http://www.theadvocates.org/)
 

 *I am a bot, and this action was performed automatically. Please [contact the moderators of this subreddit](/message/compose/?to=/r/Libertarian) if you have any questions or concerns.*",US invaded iraq. Is iraq better off today? Cherry picking something that happens so long ago to justify intervention shows the follies of interventionism.,,,Condescending Attitude,,Neutral
results/Libertarian/,Why it is so common for people to misunderstand freedom of speech in the United States?,comment_2,"Why do people cry freedom of speech every time their views are criticized or censored for being offensive?  
 

 

 In one sentence, in the simplest of terms: Freedom of speech is the right to articulate one's opinions and ideas without fear of **GOVERNMENT retaliation or censorship.**  
 This does not apply to private businesses and spaces. Privately owned entities are not required to protect your free speech. You can't scream ""FIRE"" in a movie theater and claim freedom of speech.  
 

 

 What ""Freedom Of Speech"" is **NOT:**  
 Private entities and private spaces are largely not required to protect your speech, and the first amendment does not protect what you say—only your right to speak. This means that you can say what you choose, but the nature of free speech is that others are free to say what they choose as well, even if it means disagreeing with you or mounting a campaign of people to respond to you  
 

 

 The following is a list of things that can legally be done to **you** by exercising your rights to free speech.  
 

 

 * expressing their disagreement with you
 * expressing their disagreement with you in a public forum
 * pointing out inconsistencies in your logic
 * carefully dismantling your argument piece by piece
 * calling you names
 * waging a hashtag campaign against you
 * using their positions of influence to sway people’s opinions about you
 * boycotting your company
 * encouraging others to boycott your company
 * censoring you
 * ignoring you
 * **firing you**
 * **calling on your employer to fire you**
 * calling for your resignation
 * **calling on your advertisers to stop supporting you**
 

 So why do so many people cry violation of freedom of speech when they are banned from their favorite pub for spewing racism while drinking? Or when they are banned from a community?  
 I guess what I'm looking to have explained is why this is such a common misconception, and how it can come about?","**New to libertarianism or have questions and want to learn more?** Be sure to check out [the sub Frequently Asked Questions](/r/Libertarian/wiki/faq) and [the massive /r/libertarian information WIKI] (/r/Libertarian/wiki/index) from the sidebar, for lots of info and free resources, links, books, videos, and answers to common questions and topics. Want to know if you are a Libertarian? [Take the worlds shortest political quiz and find out!](http://www.theadvocates.org/)
 

 *I am a bot, and this action was performed automatically. Please [contact the moderators of this subreddit](/message/compose/?to=/r/Libertarian) if you have any questions or concerns.*",It seems the lines get blurred when the government coerces companies to do the censoring for it.,,,,,Neutral
results/conservatives/,"Bank to Stop Giving Loans to Fossil Fuel Cars By Guest Contributor Aug. 31, 2023 10:20 am",comment_1,https://click1.e.westernjournalism.com/rrvvthykfghpthvspkjchphchjpjwbnywygljvbrgrjwrkj_icmbbnygddwydcvmzbdgg.html,"> ”By ceasing car loans for new fossil fuel vehicles, we are sending a signal to the Australian market...""
 

 ...that we would like our competitors to have their business instead.",AMEN to that!,,,,,Neutral
results/Conservative/,Cornel West Rejects Ukraine Involvement: 'The Democratic Party Is a Party of War',comment_2,The Establishment Party of War,"Remember when Democrats were the anti-war party?  
 

 Pepperidge Farms remembers.","> ""NATO is an expanding instrument of U.S. global power that provoked Russia into a criminal invasion and occupation of Ukraine""
 

 LOL wut?",,,,,Neutral
results/conservatives/,Commitee Democrats in that Whistleblower Hearing are Scratching and Clawing Like Cats...,comment_2,Trying Desperately to Cover up the Bidens' S**t.,"Second IRS whistleblower comes forward during Oversight hearing
 

 ""During his opening statement, Ziegler acknowledged that he is in fact a Democrat and also a married gay man, but contended that such characteristics did not bolster his credibility, insisting instead that his experience and expertise ought to speak for themselves.""
 

 https://justthenews.com/accountability/whistleblowers/second-irs-whistleblower-comes-forward-during-oversight-hearing","During Raskin's opening monologue he made the comment that the committee was simply embarrassing itself. Did he look in the mirror? Wearing an American flag dew rag on his head, the most god awful suit and tie combination I've seen in a while, and he claims the committee had embarrassed itself?  
 

 And how had the committee done this? Because, according to this rocket surgeon, one of the key whistle blowers, Luft, was recently indicted by the DoJ. Apparently, it is an embarrassment for the committee to want to hear testimony from someone the administration is so afraid of they've indicted him for working for the same damned Chinese company Hunter worked for.
 

 Loved how the American First Legal group has filed a lawsuit against the DoJ for failing to charge Hunter with the exact same *failure to register as a foreign agent* crime they just indicted Luft under.",,,Condescending Attitude,,Neutral
results/uspolitics/,Alexandria Ocasio-Cortez says Republicans fabricated evidence in Biden impeachment inquiry – video | US news | The Guardian,comment_2,What can I say?,"I’m sure she is right. About the evidence and the proceedings being a farce.
 

 Such schoolyard bullshit.","But she *is* right. Every single witness she asked said ""no"" to the question of ""are you presenting any firsthand witness account of crimes commited by the president of the United States"".
 

 The fucking thing was shown to look like it was a screenshot from a phone. It wasn't. And anyway, it was truncated. 
 

 So, she was right.",,,,,Neutral
results/Libertarian/,Thoughts on Incest Legality?,comment_1,"I’ve talked to maybe two dozen people about this topic and only 2 people have agreed with me. I think incest should be legal. People find this bizarre (with the exception of the 2 previously stated individuals) But I kinda just view it as a keep the government out of my bedroom type thing & a if your not hurting any non consenting party who cares thing. The biggest pushback is incest sped babies but I feel like a law is not gonna really prevent that cause who would admit that your kid is your brothers. 
 

 Fyi this is not a hill I’m dying on, this is also only my second Reddit post (first was also today). What do libertarians think about this?",Weird way to announce you're fucking your sister.,Decriminalize it. It's a non-violent victimless offense. I've never been into the idea of the government policing the bedroom.,Ad Hominem,Ad Hominem,,Ad Hominem,IA
